{
  "artifacts": [
    {
      "media_type": "application/json",
      "path": "contract/run-spec.json",
      "sha256": "c15e616e2f9810b970e193024fa43653fef1eb682f26798c40b5904ed5d68f09",
      "size_bytes": 3029,
      "source_refs": [],
      "surface": "contract"
    },
    {
      "media_type": "application/json",
      "path": "diagnostics/adapter-identity.json",
      "sha256": "c1da7be15b3a9974fb4ef91578e4ac4ba1038d7448990d0c8b09a2f1513db11c",
      "size_bytes": 222,
      "source_refs": [],
      "surface": "diagnostic"
    },
    {
      "media_type": "application/json",
      "path": "diagnostics/capabilities.json",
      "sha256": "20a7d247be83c208b57aeb9c43c7e63347ac76ad6b2c199e28f25c0ac40d57eb",
      "size_bytes": 6404,
      "source_refs": [],
      "surface": "diagnostic"
    },
    {
      "media_type": "text/plain",
      "path": "traces/adapter-stderr.log",
      "sha256": "87d070519e61243f05d28b5e3b9ffe1bfa2646480de63df770070b1cfe4439a4",
      "size_bytes": 140,
      "source_refs": [],
      "surface": "raw"
    },
    {
      "media_type": "application/x-ndjson",
      "path": "traces/normalized.ndjson",
      "sha256": "7077379f704887ecac5befa961177444ed7e3bc55a025ce3f1016bdc15edd8b6",
      "size_bytes": 5029,
      "source_refs": [],
      "surface": "normalized"
    },
    {
      "media_type": "application/x-ndjson",
      "path": "traces/raw.ndjson",
      "sha256": "a499317d5511dae5de7082d56fec569245c4f3b4492f55d9ea8c76facee12ba3",
      "size_bytes": 2897,
      "source_refs": [],
      "surface": "raw"
    }
  ],
  "backend": {
    "kind": "webkitgtk",
    "variant": "stable-ephemeral"
  },
  "capabilities": {
    "backend": "webkitgtk",
    "capabilities": {
      "page.act.javascript": {
        "availability": "supported",
        "notes": [],
        "provider": "engine",
        "semantics": "exact",
        "verification": "source-audit"
      },
      "page.act.keyboard": {
        "availability": "supported",
        "notes": [],
        "provider": "injected",
        "semantics": "normalized",
        "verification": "source-audit"
      },
      "page.act.pointer": {
        "availability": "supported",
        "notes": [],
        "provider": "injected",
        "semantics": "normalized",
        "verification": "source-audit"
      },
      "page.await": {
        "availability": "supported",
        "notes": [],
        "provider": "host",
        "semantics": "normalized",
        "verification": "source-audit"
      },
      "page.dialog": {
        "availability": "supported",
        "notes": [],
        "provider": "engine",
        "semantics": "exact",
        "verification": "source-audit"
      },
      "page.download": {
        "availability": "supported",
        "notes": [],
        "provider": "engine",
        "semantics": "normalized",
        "verification": "source-audit"
      },
      "page.navigate": {
        "availability": "supported",
        "notes": [],
        "provider": "engine",
        "semantics": "exact",
        "verification": "source-audit"
      },
      "page.navigation.history": {
        "availability": "supported",
        "notes": [],
        "provider": "engine",
        "semantics": "exact",
        "verification": "source-audit"
      },
      "page.navigation.stop": {
        "availability": "supported",
        "notes": [],
        "provider": "engine",
        "semantics": "normalized",
        "verification": "source-audit"
      },
      "page.observe.accessibility": {
        "availability": "partial",
        "notes": [
          "partial semantics must not satisfy an exact-capability gate"
        ],
        "provider": "injected",
        "semantics": "partial",
        "verification": "source-audit"
      },
      "page.observe.console": {
        "availability": "supported",
        "notes": [],
        "provider": "injected",
        "semantics": "normalized",
        "verification": "source-audit"
      },
      "page.observe.dom": {
        "availability": "supported",
        "notes": [],
        "provider": "injected",
        "semantics": "normalized",
        "verification": "source-audit"
      },
      "page.observe.network": {
        "availability": "partial",
        "notes": [
          "partial semantics must not satisfy an exact-capability gate"
        ],
        "provider": "engine",
        "semantics": "partial",
        "verification": "source-audit"
      },
      "page.observe.screenshot": {
        "availability": "supported",
        "notes": [],
        "provider": "engine",
        "semantics": "exact",
        "verification": "source-audit"
      },
      "page.observe.state": {
        "availability": "supported",
        "notes": [],
        "provider": "engine",
        "semantics": "normalized",
        "verification": "source-audit"
      },
      "page.permission": {
        "availability": "supported",
        "notes": [],
        "provider": "engine",
        "semantics": "exact",
        "verification": "source-audit"
      },
      "page.tabs": {
        "availability": "supported",
        "notes": [],
        "provider": "host",
        "semantics": "normalized",
        "verification": "source-audit"
      },
      "page.termination": {
        "availability": "supported",
        "notes": [],
        "provider": "engine",
        "semantics": "exact",
        "verification": "source-audit"
      },
      "page.upload": {
        "availability": "supported",
        "notes": [],
        "provider": "engine",
        "semantics": "exact",
        "verification": "source-audit"
      },
      "run.compare": {
        "availability": "supported",
        "notes": [],
        "provider": "host",
        "semantics": "exact",
        "verification": "source-audit"
      },
      "session.checkpoint": {
        "availability": "supported",
        "notes": [],
        "provider": "host",
        "semantics": "normalized",
        "verification": "source-audit"
      },
      "session.create": {
        "availability": "supported",
        "notes": [],
        "provider": "host",
        "semantics": "normalized",
        "verification": "source-audit"
      },
      "session.export": {
        "availability": "supported",
        "notes": [],
        "provider": "host",
        "semantics": "exact",
        "verification": "source-audit"
      },
      "session.profile.ephemeral": {
        "availability": "supported",
        "notes": [],
        "provider": "engine",
        "semantics": "exact",
        "verification": "source-audit"
      },
      "session.profile.persistent": {
        "availability": "supported",
        "notes": [],
        "provider": "engine",
        "semantics": "exact",
        "verification": "source-audit"
      }
    },
    "identity": {
      "probe": {
        "backend": "webkitgtk",
        "checks": {
          "cargo": {
            "argv": [
              "cargo",
              "--version"
            ],
            "exit_code": 0,
            "output": "cargo 1.97.1 (c980f4866 2026-06-30)",
            "present": true
          },
          "gtk4": {
            "argv": [
              "pkg-config",
              "--modversion",
              "gtk4"
            ],
            "exit_code": 0,
            "module": "gtk4",
            "output": "4.22.4",
            "present": true
          },
          "rustc": {
            "argv": [
              "rustc",
              "--version",
              "--verbose"
            ],
            "exit_code": 0,
            "output": "rustc 1.97.1 (8bab26f4f 2026-07-14)\nbinary: rustc\ncommit-hash: 8bab26f4f68e0e26f0bb7960be334d5b520ea452\ncommit-date: 2026-07-14\nhost: x86_64-unknown-linux-gnu\nrelease: 1.97.1\nLLVM version: 22.1.6",
            "present": true
          },
          "webkitgtk_6": {
            "argv": [
              "pkg-config",
              "--modversion",
              "webkitgtk-6.0"
            ],
            "exit_code": 0,
            "expected": "2.52.6",
            "matches_pin": true,
            "module": "webkitgtk-6.0",
            "output": "2.52.6",
            "present": true
          }
        },
        "display": {
          "wayland": false,
          "x11": true
        },
        "machine": "x86_64",
        "os": "Linux-7.1.9-arch1-2-x86_64-with-glibc2.44",
        "python": "3.14.7",
        "ready": true,
        "reasons": []
      }
    },
    "schema_version": "browser-workbench.capabilities/v1",
    "variant": "stable-ephemeral"
  },
  "deviations": [],
  "environment": {
    "platform": "Linux-7.1.9-arch1-2-x86_64-with-glibc2.44",
    "python": "3.14.7",
    "retry_count": 0,
    "runner": "browser-workbench/0.2.0"
  },
  "gates": [
    {
      "details": {
        "run_status": "passed"
      },
      "id": "contract",
      "kind": "contract",
      "required": true,
      "status": "passed"
    },
    {
      "details": {
        "run_status": "passed"
      },
      "id": "capabilities",
      "kind": "capability",
      "required": true,
      "status": "passed"
    },
    {
      "details": {
        "run_status": "passed"
      },
      "id": "execution",
      "kind": "execution",
      "required": true,
      "status": "passed"
    },
    {
      "details": {
        "run_status": "passed"
      },
      "id": "evidence",
      "kind": "evidence",
      "required": true,
      "status": "passed"
    },
    {
      "details": {
        "run_status": "passed"
      },
      "id": "native",
      "kind": "native",
      "required": true,
      "status": "passed"
    }
  ],
  "run_id": "parity-webkitgtk",
  "schema_version": "browser-workbench.result/v1",
  "status": "passed",
  "steps": [
    {
      "error": null,
      "method": "session.create",
      "receipt": null,
      "result": {
        "backend": {
          "identity": {
            "adapter": "browser-workbench-webkitgtk-worker",
            "adapter_version": "0.2.0",